{
  "schemaVersion": 1,
  "catalogVersion": "1.0.0",
  "targets": [
    "remotionStill",
    "aiVideo",
    "imageGeneration",
    "sceneTransition"
  ],
  "compatibilityLevels": [
    "supported",
    "simulated",
    "composition-only",
    "external-required",
    "not-applicable"
  ],
  "globalNegativeRules": {
    "common": [
      "no unintended camera direction reversal",
      "no abrupt crop",
      "no subject deformation",
      "no geometry warping"
    ],
    "lineArt": [
      "no line thickening",
      "no softened outlines",
      "no erased line details",
      "preserve the original sharp line weight"
    ],
    "identity": [
      "preserve facial identity",
      "preserve body proportions",
      "no duplicate limbs",
      "no facial feature drift"
    ],
    "product": [
      "preserve exact product shape",
      "preserve logo placement",
      "no label deformation",
      "no material substitution"
    ],
    "text": [
      "preserve exact text content",
      "no misspelling",
      "no mirrored letters",
      "no typographic distortion"
    ]
  },
  "techniques": [
    {
      "id": "static-shot",
      "canonicalNo": 1,
      "nameKo": "고정 샷",
      "nameEn": "Static Shot",
      "category": "camera-motion",
      "aliases": [],
      "naturalLanguage": [
        "카메라는 가만히 두고 보여줘",
        "구도를 고정한 채 장면을 담아줘"
      ],
      "emotionalIntents": [
        "안정",
        "관찰"
      ],
      "requiredSlots": [
        "subject",
        "startComposition"
      ],
      "defaults": {
        "stabilization": "locked-off",
        "motionBlur": "none"
      },
      "conflictsWith": [
        "handheld-shot",
        "body-mount-snorricam"
      ],
      "compatibility": {
        "remotionStill": "supported",
        "aiVideo": "supported",
        "imageGeneration": "composition-only",
        "sceneTransition": "not-applicable"
      },
      "promptKo": "삼각대에 고정한 카메라로 구도와 화각을 끝까지 유지한다.",
      "promptEn": "Use a locked-off camera and preserve the exact framing and field of view throughout the shot.",
      "negativeRules": [
        "no camera drift",
        "no zoom",
        "no random shake"
      ]
    },
    {
      "id": "pan-right",
      "canonicalNo": 2,
      "nameKo": "팬 오른쪽",
      "nameEn": "Pan Right",
      "category": "camera-motion",
      "aliases": [],
      "naturalLanguage": [
        "오른쪽으로 천천히 훑어줘",
        "카메라 시선을 오른쪽으로 돌려줘"
      ],
      "emotionalIntents": [
        "공간 공개",
        "시선 이동"
      ],
      "requiredSlots": [
        "subject",
        "direction",
        "speed",
        "startComposition",
        "endComposition"
      ],
      "defaults": {
        "direction": "right",
        "speed": "slow",
        "stabilization": "smooth"
      },
      "conflictsWith": [
        "pan-left"
      ],
      "compatibility": {
        "remotionStill": "supported",
        "aiVideo": "supported",
        "imageGeneration": "composition-only",
        "sceneTransition": "not-applicable"
      },
      "promptKo": "카메라 위치는 고정하고 수평축을 따라 오른쪽으로 부드럽게 팬하여 새 공간을 공개한다.",
      "promptEn": "Keep the camera position fixed and pan smoothly to the right on the horizontal axis to reveal the space.",
      "negativeRules": [
        "no dolly movement",
        "no leftward reversal",
        "no horizon roll"
      ]
    },
    {
      "id": "pan-left",
      "canonicalNo": 3,
      "nameKo": "팬 왼쪽",
      "nameEn": "Pan Left",
      "category": "camera-motion",
      "aliases": [],
      "naturalLanguage": [
        "왼쪽으로 화면을 훑어줘",
        "카메라를 왼쪽으로 돌려 반대편을 보여줘"
      ],
      "emotionalIntents": [
        "공간 공개",
        "시선 이동"
      ],
      "requiredSlots": [
        "subject",
        "direction",
        "speed",
        "startComposition",
        "endComposition"
      ],
      "defaults": {
        "direction": "left",
        "speed": "slow",
        "stabilization": "smooth"
      },
      "conflictsWith": [
        "pan-right"
      ],
      "compatibility": {
        "remotionStill": "supported",
        "aiVideo": "supported",
        "imageGeneration": "composition-only",
        "sceneTransition": "not-applicable"
      },
      "promptKo": "카메라 위치는 고정하고 수평축을 따라 왼쪽으로 부드럽게 팬하여 반대편 공간을 공개한다.",
      "promptEn": "Keep the camera position fixed and pan smoothly to the left on the horizontal axis to reveal the opposite side.",
      "negativeRules": [
        "no dolly movement",
        "no rightward reversal",
        "no horizon roll"
      ]
    },
    {
      "id": "whip-pan-right",
      "canonicalNo": 4,
      "nameKo": "휩 팬 오른쪽",
      "nameEn": "Whip Pan Right",
      "category": "transition",
      "aliases": [],
      "naturalLanguage": [
        "오른쪽으로 확 휙 넘겨줘",
        "빠른 오른쪽 휩팬으로 다음 장면을 연결해줘"
      ],
      "emotionalIntents": [
        "역동성",
        "충격",
        "전환"
      ],
      "requiredSlots": [
        "subject",
        "direction",
        "speed",
        "screenDirection",
        "continuity"
      ],
      "defaults": {
        "direction": "right",
        "speed": "very-fast",
        "motionBlur": "directional"
      },
      "conflictsWith": [
        "whip-pan-left",
        "static-shot"
      ],
      "compatibility": {
        "remotionStill": "simulated",
        "aiVideo": "supported",
        "imageGeneration": "not-applicable",
        "sceneTransition": "supported"
      },
      "promptKo": "오른쪽으로 매우 빠른 휩 팬을 수행하고 방향성 모션 블러의 정점에서 다음 장면으로 연결한다.",
      "promptEn": "Execute a very fast whip pan to the right and cut at peak directional motion blur into the next shot.",
      "negativeRules": [
        "no leftward reversal",
        "no radial blur",
        "no subject melting"
      ]
    },
    {
      "id": "whip-pan-left",
      "canonicalNo": 5,
      "nameKo": "휩 팬 왼쪽",
      "nameEn": "Whip Pan Left",
      "category": "transition",
      "aliases": [],
      "naturalLanguage": [
        "왼쪽으로 확 휙 넘겨줘",
        "빠른 왼쪽 휩팬으로 장면 전환해줘"
      ],
      "emotionalIntents": [
        "역동성",
        "충격",
        "전환"
      ],
      "requiredSlots": [
        "subject",
        "direction",
        "speed",
        "screenDirection",
        "continuity"
      ],
      "defaults": {
        "direction": "left",
        "speed": "very-fast",
        "motionBlur": "directional"
      },
      "conflictsWith": [
        "whip-pan-right",
        "static-shot"
      ],
      "compatibility": {
        "remotionStill": "simulated",
        "aiVideo": "supported",
        "imageGeneration": "not-applicable",
        "sceneTransition": "supported"
      },
      "promptKo": "왼쪽으로 매우 빠른 휩 팬을 수행하고 방향성 모션 블러의 정점에서 다음 장면으로 연결한다.",
      "promptEn": "Execute a very fast whip pan to the left and cut at peak directional motion blur into the next shot.",
      "negativeRules": [
        "no rightward reversal",
        "no radial blur",
        "no subject melting"
      ]
    },
    {
      "id": "tilt-up",
      "canonicalNo": 6,
      "nameKo": "틸트 업",
      "nameEn": "Tilt Up",
      "category": "camera-motion",
      "aliases": [],
      "naturalLanguage": [
        "아래에서 위로 올려다봐 줘",
        "카메라 시선을 위로 천천히 들어줘"
      ],
      "emotionalIntents": [
        "웅장함",
        "등장",
        "상승감"
      ],
      "requiredSlots": [
        "subject",
        "direction",
        "speed",
        "startComposition",
        "endComposition"
      ],
      "defaults": {
        "direction": "up",
        "speed": "slow",
        "stabilization": "smooth"
      },
      "conflictsWith": [
        "tilt-down"
      ],
      "compatibility": {
        "remotionStill": "supported",
        "aiVideo": "supported",
        "imageGeneration": "composition-only",
        "sceneTransition": "not-applicable"
      },
      "promptKo": "카메라 위치를 고정한 채 수직축으로 아래에서 위를 향해 부드럽게 틸트한다.",
      "promptEn": "Keep the camera position fixed and tilt smoothly upward on the vertical axis from the lower framing.",
      "negativeRules": [
        "no vertical translation",
        "no downward reversal",
        "keep horizon level"
      ]
    },
    {
      "id": "tilt-down",
      "canonicalNo": 7,
      "nameKo": "틸트 다운",
      "nameEn": "Tilt Down",
      "category": "camera-motion",
      "aliases": [],
      "naturalLanguage": [
        "위에서 아래로 내려다보며 보여줘",
        "카메라 시선을 아래로 천천히 내려줘"
      ],
      "emotionalIntents": [
        "목적지 공개",
        "집중",
        "하강감"
      ],
      "requiredSlots": [
        "subject",
        "direction",
        "speed",
        "startComposition",
        "endComposition"
      ],
      "defaults": {
        "direction": "down",
        "speed": "slow",
        "stabilization": "smooth"
      },
      "conflictsWith": [
        "tilt-up"
      ],
      "compatibility": {
        "remotionStill": "supported",
        "aiVideo": "supported",
        "imageGeneration": "composition-only",
        "sceneTransition": "not-applicable"
      },
      "promptKo": "카메라 위치를 고정한 채 수직축으로 위에서 아래를 향해 부드럽게 틸트한다.",
      "promptEn": "Keep the camera position fixed and tilt smoothly downward on the vertical axis from the upper framing.",
      "negativeRules": [
        "no vertical translation",
        "no upward reversal",
        "keep horizon level"
      ]
    },
    {
      "id": "slow-zoom-in",
      "canonicalNo": 8,
      "nameKo": "슬로우 줌 인",
      "nameEn": "Slow Zoom In",
      "category": "camera-motion",
      "aliases": [],
      "naturalLanguage": [
        "인물에게 천천히 당겨줘",
        "서서히 가까이 확대해서 집중시켜줘"
      ],
      "emotionalIntents": [
        "집중",
        "감정",
        "긴장"
      ],
      "requiredSlots": [
        "subject",
        "speed",
        "startComposition",
        "endComposition",
        "focalPoint"
      ],
      "defaults": {
        "direction": "inward",
        "speed": "slow",
        "subjectLock": true,
        "motionBlur": "minimal"
      },
      "conflictsWith": [
        "slow-zoom-out",
        "fast-zoom-out"
      ],
      "compatibility": {